<?xml version="1.0" encoding="UTF-8"?>
<xs:schema xmlns:xs="http://www.w3.org/2001/XMLSchema">
	<xs:element name="list">
		<xs:complexType>
			<xs:sequence maxOccurs="1" minOccurs="1">
				<xs:element name="fishingMonster" maxOccurs="8" minOccurs="1">
					<xs:complexType>
						<xs:attribute name="fishingMonsterId" use="required">
							<xs:simpleType>
								<xs:restriction base="xs:positiveInteger">
									<xs:minInclusive value="1" />
									<xs:maxInclusive value="65535" />
								</xs:restriction>
							</xs:simpleType>
						</xs:attribute>
						<xs:attribute name="probability" use="required">
							<xs:simpleType>
								<xs:restriction base="xs:positiveInteger">
									<xs:minInclusive value="1" />
									<xs:maxInclusive value="100" />
								</xs:restriction>
							</xs:simpleType>
						</xs:attribute>
						<xs:attribute name="userMaxLevel" use="required">
							<xs:simpleType>
								<xs:restriction base="xs:positiveInteger">
									<xs:minInclusive value="1" />
									<xs:maxInclusive value="85" />
								</xs:restriction>
							</xs:simpleType>
						</xs:attribute>
						<xs:attribute name="userMinLevel" use="required">
							<xs:simpleType>
								<xs:restriction base="xs:positiveInteger">
									<xs:minInclusive value="1" />
									<xs:maxInclusive value="85" />
								</xs:restriction>
							</xs:simpleType>
						</xs:attribute>
					</xs:complexType>
				</xs:element>
			</xs:sequence>
		</xs:complexType>
	</xs:element>
</xs:schema>