<?xml version="1.0" encoding="UTF-8"?>
<list xmlns:xsi="http://www.w3.org/2001/XMLSchema-instance" xsi:noNamespaceSchemaLocation="../../../xsd/fishingMonsters.xsd">
	<fishingMonster userMinLevel="6" userMaxLevel="15" fishingMonsterId="18319" probability="5" />
	<fishingMonster userMinLevel="16" userMaxLevel="25" fishingMonsterId="18320" probability="5" />
	<fishingMonster userMinLevel="26" userMaxLevel="35" fishingMonsterId="18321" probability="5" />
	<fishingMonster userMinLevel="36" userMaxLevel="45" fishingMonsterId="18322" probability="5" />
	<fishingMonster userMinLevel="46" userMaxLevel="55" fishingMonsterId="18323" probability="5" />
	<fishingMonster userMinLevel="56" userMaxLevel="65" fishingMonsterId="18324" probability="5" />
	<fishingMonster userMinLevel="66" userMaxLevel="75" fishingMonsterId="18325" probability="5" />
	<fishingMonster userMinLevel="76" userMaxLevel="85" fishingMonsterId="18326" probability="5" />
</list>